{
  "schemaVersion": 1,
  "id": "kuumetsu-last-result-integrity-20260920",
  "game": "kuumetsu",
  "kind": "gameplay",
  "problemKey": "saved-settlement-semantic-corruption",
  "observation": {
    "summary": "readProgress validates lastResult field types but accepts semantically impossible reward/loss combinations.",
    "evidence": [
      {
        "kind": "source",
        "revision": "6672dfa9b0d869cb73386525ea6ce2f383e110a8",
        "path": "apps/demon/src/hunt/balance.js",
        "symbol": "readProgress(lastResult)",
        "statement": "Fields are range/type checked individually; extracted/cleared/gained/lost/carried/bonus relationships are not checked."
      }
    ]
  },
  "hypothesis": {
    "cause": "Persisted settlement validation lacks the same invariants produced by settleProgress.",
    "prediction": "Rejecting impossible reward/loss combinations makes corrupted settlement records fail closed without changing any valid settlement generated by current code.",
    "falsifier": "A current valid settlement is rejected or a contradictory record is still accepted."
  },
  "candidates": [
    {
      "id": "validate-settlement-invariants",
      "selected": true,
      "reason": "Matches current canonical writer semantics at the read boundary."
    },
    {
      "id": "repair-corrupt-results",
      "selected": false,
      "reason": "Would invent historical rewards/losses instead of failing closed."
    }
  ],
  "implementation": {
    "paths": [
      "apps/demon/src/hunt/balance.js",
      "apps/demon/tests/hunt-loop-native.test.mjs"
    ],
    "summary": "Validate persisted settlement reward/loss coherence and add one assertion inside the existing native loop case."
  },
  "comparison": {
    "objective": "reproducible-causality",
    "verdict": "pending",
    "before": {
      "revision": "6672dfa9b0d869cb73386525ea6ce2f383e110a8",
      "summary": "Contradictory defeated result with gained reward can pass readProgress."
    },
    "after": null,
    "limitations": [
      "Persistence invariant only; no browser or combat-feel claim."
    ]
  },
  "validation": {
    "state": "awaiting-exact-head-receipt",
    "focusedTests": [
      "tests/develop-completion-contract.test.mjs",
      "apps/demon/tests/hunt-loop-native.test.mjs"
    ],
    "receipt": {
      "repository": "charukun/soul-lineage",
      "pullRequest": null,
      "marker": "autonomous-receipt:kuumetsu:kuumetsu-last-result-integrity-20260920"
    }
  },
  "learning": {
    "summary": "Pending hosted evidence.",
    "failedApproaches": [],
    "doNotRetry": [],
    "unresolved": [],
    "next": [
      "Inspect one separate hunt-selection invariant after merge."
    ]
  }
}
