{
  "schemaVersion": 1,
  "id": "village-arrival-commit-20260920",
  "game": "village",
  "kind": "gameplay",
  "problemKey": "arrival-failure-mutates-stats",
  "observation": {
    "summary": "Simulation.arrive increments persistent arrival statistics before confirming a legal spawn point, so a failed arrival mutates history.",
    "evidence": [
      {
        "kind": "source",
        "revision": "d749d3597cab5a3e41d1e5e1ef22348fe5335f8e",
        "path": "apps/village/src/game/simulation.js",
        "symbol": "Simulation.arrive",
        "statement": "stats.arrivals is post-incremented before nav.free is checked, and the method can return false immediately afterward."
      }
    ]
  },
  "hypothesis": {
    "cause": "The arrival counter is committed before the final fallible spawn precondition.",
    "prediction": "Moving the counter increment after spawn validation leaves failed arrivals side-effect free while successful arrivals retain monotonic numbering.",
    "falsifier": "A failed spawn still changes arrivals, or successful arrival naming/statistics regress."
  },
  "candidates": [
    {
      "id": "commit-after-spawn-validation",
      "selected": true,
      "reason": "Preserves existing flow and commits persistent history only after the fallible boundary passes."
    },
    {
      "id": "rollback-on-failure",
      "selected": false,
      "reason": "Adds compensating mutation where ordering alone can preserve atomicity."
    }
  ],
  "implementation": {
    "paths": [
      "apps/village/src/game/simulation.js",
      "apps/village/tests/rules.test.mjs"
    ],
    "summary": "Delay arrival counter mutation until a valid spawn exists and add regression coverage inside an existing test case."
  },
  "comparison": {
    "objective": "reproducible-causality",
    "verdict": "pending",
    "before": {
      "revision": "d749d3597cab5a3e41d1e5e1ef22348fe5335f8e",
      "summary": "A forced nav.free failure increments stats.arrivals despite returning false."
    },
    "after": null,
    "limitations": [
      "Covers arrival state atomicity only; no browser/player-experience claim."
    ]
  },
  "validation": {
    "state": "awaiting-exact-head-receipt",
    "focusedTests": [
      "tests/develop-completion-contract.test.mjs",
      "apps/village/tests/rules.test.mjs"
    ],
    "receipt": {
      "repository": "charukun/soul-lineage",
      "pullRequest": null,
      "marker": "autonomous-receipt:village:village-arrival-commit-20260920"
    }
  },
  "learning": {
    "summary": "Pending hosted evidence.",
    "failedApproaches": [],
    "doNotRetry": [],
    "unresolved": [],
    "next": [
      "Inspect one separate village invariant after merge."
    ]
  }
}
