{
  "schemaVersion": 1,
  "id": "village-raid-max-health-20260920",
  "game": "village",
  "kind": "gameplay",
  "problemKey": "raid-elite-health-exceeds-max",
  "observation": {
    "summary": "Village raid elites spawn with 1.4x current health but retain the normal unit maxHealth, creating health > maxHealth at creation.",
    "evidence": [
      {
        "kind": "source",
        "revision": "9c53903a924ac0f9c4803b198a26e1e9d234c28e",
        "path": "apps/village/src/game/simulation.js",
        "symbol": "Simulation.startRaid",
        "statement": "Elite health multiplies budget.health by 1.4 while maxHealth is assigned budget.health unconditionally."
      }
    ]
  },
  "hypothesis": {
    "cause": "Elite scaling is applied only to health, not to the matching maximum-health state.",
    "prediction": "Deriving one maxHealth value per actor and assigning both fields from it makes every raid actor spawn with health <= maxHealth while preserving elite durability.",
    "falsifier": "Any spawned actor still has health greater than maxHealth or elite health loses its authored 1.4x scaling."
  },
  "candidates": [
    {
      "id": "single-derived-max-health",
      "selected": true,
      "reason": "Keeps authored elite multiplier and removes contradictory state at creation."
    },
    {
      "id": "clamp-current-health-to-normal-max",
      "selected": false,
      "reason": "Would silently erase elite durability instead of repairing the invariant."
    }
  ],
  "implementation": {
    "paths": [
      "apps/village/src/game/simulation.js",
      "apps/village/tests/simulation-scale-runtime.test.mjs"
    ],
    "summary": "Use the same scaled maxHealth for elite current/max HP and assert the spawn invariant in an existing Simulation test."
  },
  "comparison": {
    "objective": "reproducible-causality",
    "verdict": "pending",
    "before": {
      "revision": "9c53903a924ac0f9c4803b198a26e1e9d234c28e",
      "summary": "Every sixth raid actor can spawn at 140% of its recorded maxHealth."
    },
    "after": null,
    "limitations": [
      "Direct native spawn invariant only; no visual HUD/browser claim."
    ]
  },
  "validation": {
    "state": "awaiting-exact-head-receipt",
    "focusedTests": [
      "tests/develop-completion-contract.test.mjs",
      "apps/village/tests/simulation-scale-runtime.test.mjs"
    ],
    "receipt": {
      "repository": "charukun/soul-lineage",
      "pullRequest": null,
      "marker": "autonomous-receipt:village:village-raid-max-health-20260920"
    }
  },
  "learning": {
    "summary": "Pending hosted evidence.",
    "failedApproaches": [],
    "doNotRetry": [],
    "unresolved": [],
    "next": [
      "After merge, switch to kuumetsu and choose its first independent root cause."
    ]
  }
}
